{
  "id": "of-the-bulwark",
  "name": "of the Bulwark",
  "position": "suffix",
  "lines": [
    {
      "bandMin": "F",
      "bandMax": "D",
      "effect": {
        "kind": "applyStatus",
        "status": "fortify",
        "duration": 1,
        "target": "self",
        "note": "on block only (shields, Plate Chest): the roll is the chance; the block trigger is a hook"
      },
      "min": 20,
      "max": 20
    },
    {
      "bandMin": "C",
      "bandMax": "A",
      "effect": {
        "kind": "applyStatus",
        "status": "fortify",
        "duration": 1,
        "target": "self",
        "note": "on block only (shields, Plate Chest): the roll is the chance; the block trigger is a hook"
      },
      "min": 35,
      "max": 35
    },
    {
      "bandMin": "S",
      "bandMax": "God",
      "effect": {
        "kind": "applyStatus",
        "status": "fortify",
        "duration": 1,
        "target": "self",
        "note": "on block only (shields, Plate Chest): the roll is the chance; the block trigger is a hook"
      },
      "min": 50,
      "max": 50
    }
  ],
  "slots": [
    "offHand",
    "chest"
  ],
  "weight": 2,
  "tags": [
    "defensive",
    "block"
  ]
}
