{
  "id": "arcane",
  "name": "Arcane",
  "position": "prefix",
  "lines": [
    {
      "bandMin": "F",
      "bandMax": "D",
      "stat": "attackSpell",
      "unit": "flat",
      "min": 1,
      "max": 3
    },
    {
      "bandMin": "C",
      "bandMax": "A",
      "stat": "attackSpell",
      "unit": "flat",
      "min": 3,
      "max": 8
    },
    {
      "bandMin": "S",
      "bandMax": "God",
      "stat": "attackSpell",
      "unit": "flat",
      "min": 8,
      "max": 20
    }
  ],
  "slots": [
    "mainHand",
    "offHand",
    "helmet",
    "chest",
    "legs",
    "boots",
    "gloves"
  ],
  "weight": 5,
  "tags": [
    "offensive",
    "spell"
  ]
}
