{
  "id": "shocking",
  "name": "Shocking",
  "position": "prefix",
  "lines": [
    {
      "bandMin": "F",
      "bandMax": "D",
      "effect": {
        "kind": "applyStatus",
        "status": "shock",
        "target": "enemy"
      },
      "min": 5,
      "max": 8
    },
    {
      "bandMin": "C",
      "bandMax": "A",
      "effect": {
        "kind": "applyStatus",
        "status": "shock",
        "target": "enemy"
      },
      "min": 8,
      "max": 12
    },
    {
      "bandMin": "S",
      "bandMax": "God",
      "effect": {
        "kind": "applyStatus",
        "status": "shock",
        "target": "enemy"
      },
      "min": 12,
      "max": 20
    }
  ],
  "slots": [
    "mainHand",
    "offHand"
  ],
  "weight": 3,
  "tags": [
    "offensive",
    "status",
    "shock"
  ]
}
